{
  "id": "features.cards-1x3",
  "category": "FEATURES",
  "purpose": "Three cards with a top rule only (padding 28), left-aligned h2-48 heading and optional sub line. Appears twice on /data-apps, once on /metrics-catalog, /interactive-dashboards and /context-layer (heading-less).",
  "status": "measured",
  "composable": true,
  "implementedBy": "src/components/shared/FeatureCards.jsx (layout 1x3)",
  "content": {
    "fields": {
      "heading": {
        "type": "text",
        "required": false,
        "maxWords": 12,
        "observedMaxWords": 9,
        "wcRef": "features.cards-1x3.heading"
      },
      "sub": {
        "type": "text",
        "required": false,
        "maxWords": 28,
        "observedMaxWords": 22,
        "wcRef": "features.cards-1x3.sub"
      },
      "cards": {
        "type": "list",
        "required": true,
        "item": {
          "title": {
            "type": "text",
            "required": true,
            "maxWords": 7,
            "observedMaxWords": 5,
            "wcRef": "features.cards-1x3.cards[].title"
          },
          "body": {
            "type": "text",
            "required": true,
            "maxWords": 29,
            "observedMaxWords": 23,
            "wcRef": "features.cards-1x3.cards[].body"
          }
        },
        "minItems": 3,
        "maxItems": 3
      },
      "sectionLines": {
        "type": "enum",
        "required": false,
        "values": [
          "none",
          "rl"
        ]
      }
    },
    "additionalProperties": false
  },
  "constraints": {
    "maxPerPage": 2
  },
  "motion": {
    "allowedPatterns": [
      "swipe-carousel",
      "none"
    ],
    "reducedMotionFallbackRequired": true,
    "reducedMotionFallbacks": {
      "swipe-carousel": "instant-swap",
      "none": "not-applicable"
    },
    "reducedMotionBases": {
      "swipe-carousel": "recommended-not-implemented",
      "none": "recommended-not-implemented"
    }
  },
  "responsive": [
    {
      "query": "(max-width: 809.98px)",
      "change": "grid becomes a swipe carousel: cards 280x400 with a solid 1px border, scroll-snap x mandatory, dots below",
      "cssCite": "src/components/shared/FeatureCards.jsx:25"
    }
  ],
  "measuredFrom": [
    "src/components/shared/FeatureCards.jsx:4",
    "src/components/shared/FeatureCards.jsx:10",
    "src/components/shared/MobileCarousel.jsx:4"
  ],
  "notes": [
    "/context-layer renders the 3 cards without a heading (src/pages/ContextLayer.jsx FeatureCards layout=\"1x3\" cards={D.cards}); heading is therefore optional per use.",
    "/interactive-dashboards enables mobileCarousel for this layout; the others do not."
  ],
  "schemaVersion": "1.0.0",
  "usedByTemplates": [
    "product-context-layer",
    "product-data-apps",
    "product-interactive-dashboards",
    "product-metrics-catalog"
  ],
  "source": {
    "id": "FeatureCards.jsx@37",
    "tag": "section",
    "file": "src/components/shared/FeatureCards.jsx",
    "lines": "37"
  },
  "semantic": {
    "id": "features.cards-1x3",
    "category": "FEATURES"
  },
  "retrievalEligible": true,
  "generatedAssetRoles": []
}
