{
  "id": "app.view-customers",
  "category": "APP",
  "purpose": "Game Boy app view \"Customers\": bento of customer stat/quote tiles (fal, OakNorth, JustWatch, Workday + logo tiles) with a VIEW CUSTOMERS call to action. An iframe state reached via the planet menu, NOT a route and NOT a PageSpec node.",
  "status": "iframe-opaque",
  "composable": false,
  "fixedContent": true,
  "evidenceNote": "Documented from CLONE_SPEC section 6 text and reference/sections screenshots; the app DOM is not inspected.",
  "implementedBy": "src/components/Hero.jsx > iframe public/gameboy/index.html",
  "content": {
    "fields": {},
    "additionalProperties": false
  },
  "constraints": {
    "iframeStateOf": "hero.gameboy-app"
  },
  "motion": {
    "allowedPatterns": [
      "iframe-app"
    ],
    "reducedMotionFallbackRequired": true,
    "reducedMotionFallbacks": {
      "iframe-app": "not-applicable"
    },
    "reducedMotionBases": {
      "iframe-app": "recommended-not-implemented"
    }
  },
  "responsive": [],
  "measuredFrom": [
    "CLONE_SPEC.md:292",
    "src/components/Hero.jsx:62"
  ],
  "notes": [
    "Listed in templates.json template.home iframeStates, never in nodes (the schema has no node alternative for it)."
  ],
  "schemaVersion": "1.0.0",
  "responsiveNote": "No breakpoint-specific behaviour is specified for this section in the source CSS/JSX.",
  "usedByTemplates": [
    "home"
  ],
  "source": {
    "id": "Hero.jsx@62",
    "tag": "iframe",
    "file": "src/components/Hero.jsx",
    "lines": "62"
  },
  "semantic": {
    "id": "app.view-customers",
    "category": "APP"
  },
  "retrievalEligible": false,
  "retrievalReason": "Interactive iframe state of the home Game Boy app, reached only by in-app interaction; not a composable page section.",
  "generatedAssetRoles": []
}
