{
  "id": "chrome.navbar-light",
  "category": "CHROME",
  "purpose": "Fixed top navigation (light variant, every inner route): Rive wordmark, Product / Customers / Resources mega-menus, Pricing, Login and two buttons. Fixed content from src/navData.js; not composable per page.",
  "status": "measured",
  "composable": true,
  "fixedContent": true,
  "implementedBy": "src/components/Navbar.jsx (variant=\"light\")",
  "content": {
    "fields": {
      "brandMark": {
        "type": "media",
        "required": false,
        "assetRoles": [
          "brand.lightdash-wordmark",
          "brand.placeholder-mark",
          "asset.operator-supplied"
        ]
      },
      "chromeData": {
        "type": "media",
        "required": false,
        "assetRoles": [
          "content.lightdash-chrome-data",
          "content.operator-supplied-chrome"
        ]
      }
    },
    "additionalProperties": false
  },
  "constraints": {
    "onePerPage": true,
    "chromeAxis": [
      "light-banner-cta",
      "light-cta",
      "light-no-cta"
    ]
  },
  "motion": {
    "allowedPatterns": [
      "nav-spring",
      "none"
    ],
    "reducedMotionFallbackRequired": true,
    "reducedMotionFallbacks": {
      "nav-spring": "instant-swap",
      "none": "not-applicable"
    },
    "reducedMotionBases": {
      "nav-spring": "recommended-not-implemented",
      "none": "recommended-not-implemented"
    }
  },
  "responsive": [
    {
      "query": "(max-width: 1099.98px)",
      "change": "the 106px desktop bar is replaced by the 64px phone bar (MobileNav) with a hamburger",
      "cssCite": "src/layouts/InnerLayout.jsx:11"
    }
  ],
  "measuredFrom": [
    "src/navData.js:23-71",
    "src/components/Navbar.jsx:117",
    "CLONE_SPEC.md:104"
  ],
  "notes": [
    "Menu copy, icons and hrefs are fixed data in src/navData.js (PRODUCT_ITEMS, PLATFORM_ITEMS, CUSTOMER_GROUPS, RESOURCE_*). A PageSpec cannot override them.",
    "The wordmark is a Rive state machine (@rive-app/canvas) on the live site; the static SVG shows until it loads.",
    "Optional slot field(s) brandMark, chromeData added for modes: omitted (or bound to the clone-only role) the fixed Lightdash chrome / app renders, which only clone mode allows; generation mode requires each slot bound to a generation-safe role (semantic_validate.py GENERATION_MODE_LOGO / _COPY / _EMBED)."
  ],
  "schemaVersion": "1.0.0",
  "usedByTemplates": [
    "about",
    "beyond-copilots",
    "blog-category",
    "blog-index",
    "blog-post",
    "customer-stories",
    "customer-story",
    "event",
    "fintech",
    "integrations",
    "jp",
    "legal",
    "lightdash-security",
    "not-found",
    "padel-apply",
    "partnerships",
    "playground",
    "pricing",
    "product-bi-as-code",
    "product-context-layer",
    "product-conversational-analytics",
    "product-data-apps",
    "product-embedding",
    "product-interactive-dashboards",
    "product-metrics-catalog",
    "product-self-improving-analytics",
    "roadmap",
    "start",
    "startups"
  ],
  "source": {
    "id": "Navbar.jsx@476",
    "tag": "div",
    "file": "src/components/Navbar.jsx",
    "lines": "476"
  },
  "semantic": {
    "id": "chrome.navbar-light",
    "category": "CHROME"
  },
  "retrievalEligible": true,
  "generatedAssetRoles": [
    "asset.operator-supplied",
    "brand.placeholder-mark",
    "content.operator-supplied-chrome"
  ]
}
