{
  "id": "proof.customer-quote",
  "category": "PROOF",
  "purpose": "Large centred customer quote with logo and attribution row, without a stat row or case-study button (/data-apps only).",
  "status": "measured",
  "composable": true,
  "implementedBy": "src/components/shared/CustomerQuote.jsx (no stats, no cta)",
  "content": {
    "fields": {
      "logo": {
        "type": "media",
        "required": true,
        "assetRoles": [
          "logo.customer-partner",
          "logo.placeholder-company",
          "asset.operator-supplied"
        ],
        "altMaxWords": 3
      },
      "quote": {
        "type": "text",
        "required": true,
        "maxWords": 48,
        "observedMaxWords": 38,
        "wcRef": "proof.customer-quote.quote"
      },
      "personName": {
        "type": "text",
        "required": true,
        "maxWords": 4,
        "observedMaxWords": 2,
        "wcRef": "proof.customer-quote.personName"
      },
      "personRole": {
        "type": "text",
        "required": true,
        "maxWords": 8,
        "observedMaxWords": 6,
        "wcRef": "proof.customer-quote.personRole"
      },
      "photo": {
        "type": "media",
        "required": true,
        "assetRoles": [
          "photo.person-avatar",
          "avatar.fictional-person",
          "asset.operator-supplied"
        ],
        "altMaxWords": 3
      },
      "quoteSize": {
        "type": "enum",
        "required": true,
        "values": [
          "40",
          "32"
        ]
      }
    },
    "additionalProperties": false
  },
  "constraints": {
    "maxPerPage": 1
  },
  "motion": {
    "allowedPatterns": [
      "none"
    ],
    "reducedMotionFallbackRequired": true,
    "reducedMotionFallbacks": {
      "none": "not-applicable"
    },
    "reducedMotionBases": {
      "none": "recommended-not-implemented"
    }
  },
  "responsive": [
    {
      "query": "(max-width: 809.98px)",
      "change": "quote block padding 72/64 -> 56/28 and the attribution row stacks",
      "cssCite": "src/components/shared/CustomerQuote.jsx:56"
    }
  ],
  "measuredFrom": [
    "src/components/shared/CustomerQuote.jsx:4",
    "src/components/shared/CustomerQuote.jsx:70",
    "src/pages/ContextLayer.jsx:48"
  ],
  "notes": [
    "Real customer quote and a real named person (data-apps: OakNorth). A generated page may not reproduce real quotes, names or photos."
  ],
  "schemaVersion": "1.0.0",
  "usedByTemplates": [
    "product-data-apps"
  ],
  "source": {
    "id": "CustomerQuote.jsx@52",
    "tag": "section",
    "file": "src/components/shared/CustomerQuote.jsx",
    "lines": "52"
  },
  "semantic": {
    "id": "proof.customer-quote",
    "category": "PROOF"
  },
  "retrievalEligible": true,
  "generatedAssetRoles": [
    "asset.operator-supplied",
    "avatar.fictional-person",
    "logo.placeholder-company"
  ]
}
