{
  "id": "chrome.announcement-bar",
  "category": "CHROME",
  "purpose": "Fixed 40px dark banner above the light navbar on the 8 product pages: a launch headline, a short phone variant and a \"Learn how\" link.",
  "status": "measured",
  "composable": true,
  "implementedBy": "src/components/shared/AnnouncementBar.jsx (mounted by src/layouts/InnerLayout.jsx banner)",
  "content": {
    "fields": {
      "text": {
        "type": "text",
        "required": true,
        "maxWords": 10,
        "observedMaxWords": 8,
        "wcRef": "chrome.announcement-bar.text"
      },
      "mobileText": {
        "type": "text",
        "required": true,
        "maxWords": 9,
        "observedMaxWords": 7,
        "wcRef": "chrome.announcement-bar.mobileText"
      },
      "linkLabel": {
        "type": "text",
        "required": true,
        "maxWords": 4,
        "observedMaxWords": 2,
        "wcRef": "chrome.announcement-bar.linkLabel"
      },
      "target": {
        "type": "link",
        "required": true,
        "actions": [
          "navigate-route",
          "open-external"
        ]
      }
    },
    "additionalProperties": false
  },
  "constraints": {
    "onePerPage": true,
    "mustBeFirst": true,
    "chromeAxis": [
      "light-banner-cta"
    ]
  },
  "motion": {
    "allowedPatterns": [
      "scroll-linked-offset",
      "none"
    ],
    "reducedMotionFallbackRequired": true,
    "reducedMotionFallbacks": {
      "scroll-linked-offset": "static-final-state",
      "none": "not-applicable"
    },
    "reducedMotionBases": {
      "scroll-linked-offset": "recommended-not-implemented",
      "none": "recommended-not-implemented"
    }
  },
  "responsive": [
    {
      "query": "(max-width: 809.98px)",
      "change": "long text hidden, short mobileText shown; bar is 39 tall instead of 40",
      "cssCite": "src/components/shared/AnnouncementBar.jsx:46-47"
    }
  ],
  "measuredFrom": [
    "src/components/shared/AnnouncementBar.jsx:5-9",
    "src/layouts/InnerLayout.jsx:29-32",
    "src/App.jsx:84"
  ],
  "notes": [
    "Mounted by InnerLayout only when banner={true} (App.jsx banner route group). The bar and the navbar scroll away together: translateY(-min(scrollY, 40)), scroll-linked with no tween (InnerLayout.jsx)."
  ],
  "schemaVersion": "1.0.0",
  "usedByTemplates": [
    "product-bi-as-code",
    "product-context-layer",
    "product-conversational-analytics",
    "product-data-apps",
    "product-embedding",
    "product-interactive-dashboards",
    "product-metrics-catalog",
    "product-self-improving-analytics"
  ],
  "source": {
    "id": "AnnouncementBar.jsx@41",
    "tag": "SmartLink",
    "file": "src/components/shared/AnnouncementBar.jsx",
    "lines": "41-54"
  },
  "semantic": {
    "id": "chrome.announcement-bar",
    "category": "CHROME"
  },
  "retrievalEligible": true,
  "generatedAssetRoles": []
}
