{
  "id": "content.story-stats-row",
  "category": "CONTENT",
  "purpose": "N equal stat cells (N = 2-4 = statCount in specs/cms/customer-stories.json), each 112 tall: a 32px value and a 14px label. The clone renders placeholder values.",
  "status": "measured-structure-placeholder-body",
  "composable": true,
  "evidenceNote": "statCount per story is measured; the values/labels are placeholders (\"00+\", \"Placeholder metric label\").",
  "implementedBy": "src/pages/CustomerStory.jsx (inline)",
  "content": {
    "fields": {
      "cells": {
        "type": "list",
        "required": true,
        "item": {
          "value": {
            "type": "text",
            "required": true,
            "maxWords": 3,
            "observedMaxWords": 1,
            "wcRef": "content.story-stats-row.cells[].value"
          },
          "label": {
            "type": "text",
            "required": true,
            "maxWords": 5,
            "observedMaxWords": 3,
            "wcRef": "content.story-stats-row.cells[].label"
          }
        },
        "minItems": 2,
        "maxItems": 4
      }
    },
    "additionalProperties": false
  },
  "constraints": {
    "maxPerPage": 1
  },
  "motion": {
    "allowedPatterns": [
      "none"
    ],
    "reducedMotionFallbackRequired": true,
    "reducedMotionFallbacks": {
      "none": "not-applicable"
    },
    "reducedMotionBases": {
      "none": "recommended-not-implemented"
    }
  },
  "responsive": [
    {
      "query": "(max-width: 1099.98px)",
      "change": "cells wrap: 3 per row at 810, 1 per row on phone (basis-1/3, basis-full)",
      "cssCite": "src/pages/CustomerStory.jsx:90"
    }
  ],
  "measuredFrom": [
    "src/pages/CustomerStory.jsx:87",
    "specs/cms/customer-stories.json:52"
  ],
  "notes": [
    "Real outcome numbers exist on the live story pages but were not captured: do not invent them."
  ],
  "schemaVersion": "1.0.0",
  "usedByTemplates": [
    "customer-story"
  ],
  "source": {
    "id": "CustomerStory.jsx@88",
    "tag": "div",
    "file": "src/pages/CustomerStory.jsx",
    "lines": "88"
  },
  "semantic": {
    "id": "content.story-stats-row",
    "category": "CONTENT"
  },
  "retrievalEligible": true,
  "generatedAssetRoles": []
}
